{
  "schemaVersion": 1,
  "id": "javascript-basics-spread-and-rest",
  "subjectId": "react",
  "chapterId": "javascript-basics",
  "title": "Spread and rest",
  "language": "en",
  "status": "sample-draft",
  "reviewedAt": "2026-09-20",
  "runtime": "Modern evergreen browser or Node.js with ES modules. Run fragments in browser DevTools or a small .js file unless the example says otherwise.",
  "prerequisiteTopicIds": [
    "javascript-basics-destructuring"
  ],
  "estimatedMinutes": {
    "firstPass": 45,
    "practice": 55,
    "project": 25
  },
  "objectives": [
    {
      "id": "difference",
      "text": "Explain spread and rest from their position."
    },
    {
      "id": "array",
      "text": "Copy and combine arrays with spread."
    },
    {
      "id": "object",
      "text": "Copy and override object properties."
    },
    {
      "id": "arguments",
      "text": "Collect flexible function arguments carefully."
    }
  ],
  "learningFlow": [
    "Recall the prerequisite",
    "Predict before running code",
    "Read each concept explanation",
    "Change a small example",
    "Attempt practice before hints",
    "Explain the result in your own words",
    "Apply the idea in a different problem",
    "Review after two and seven days"
  ],
  "diagnostic": [
    {
      "question": "Can you explain the main purpose of spread and rest before reading?",
      "answer": "A complete answer should name the problem it solves, the values or control flow involved, and one mistake to avoid.",
      "ifMissed": "javascript-basics-destructuring"
    }
  ],
  "sections": [
    {
      "id": "difference",
      "title": "The same dots have two jobs",
      "depth": "core",
      "body": "Spread expands an iterable or object into another literal or call. Rest collects remaining arguments or pattern values into one array or object. Read the surrounding syntax: on the input side it collects; in an array, object, or call it expands.",
      "sourceIds": [
        "mdn-spread"
      ],
      "exampleIds": [
        "example-1"
      ],
      "objectiveIds": [
        "difference"
      ]
    },
    {
      "id": "array",
      "title": "Array spread",
      "depth": "core",
      "body": "[...items] creates a shallow array copy, and [...left, ...right] combines arrays. The outer array is new, but nested objects keep the same references. Spread is useful for immutable updates such as [...items, newItem], but repeated spreading of huge arrays can cost time and memory.",
      "sourceIds": [
        "mdn-spread"
      ],
      "exampleIds": [
        "example-2"
      ],
      "objectiveIds": [
        "array"
      ]
    },
    {
      "id": "object",
      "title": "Object spread",
      "depth": "core",
      "body": "{ ...user, name: \"Mina\" } copies enumerable own properties and then replaces name. Later properties win. It is a shallow copy, so nested objects are shared unless you copy the specific nested level too. Getters and special descriptors are not preserved like a full clone.",
      "sourceIds": [
        "mdn-spread"
      ],
      "exampleIds": [
        "example-3"
      ],
      "objectiveIds": [
        "object"
      ]
    },
    {
      "id": "arguments",
      "title": "Rest parameters",
      "depth": "core",
      "body": "function sum(...numbers) collects supplied arguments into a real array. A rest parameter must be last and there can be only one. Prefer a clear array or options object when an unbounded argument list would make the API harder to understand.",
      "sourceIds": [
        "mdn-spread"
      ],
      "exampleIds": [],
      "objectiveIds": [
        "arguments"
      ]
    },
    {
      "id": "react-connection",
      "title": "Why this matters in React",
      "depth": "deeper",
      "body": "Spread and rest is part of the JavaScript model React code already uses. Components, event handlers, state updates, list rendering, and data requests become easier to reason about when this concept is understood without framework shortcuts. Practise the JavaScript behavior first, then identify the same rule in JSX or a component.",
      "sourceIds": [
        "mdn-spread"
      ],
      "exampleIds": [],
      "objectiveIds": [
        "difference",
        "array",
        "object",
        "arguments"
      ]
    }
  ],
  "examples": [
    {
      "id": "example-1",
      "title": "Apply: The same dots have two jobs",
      "kind": "fragment",
      "language": "js",
      "depth": "core",
      "code": "const base = [1, 2];\nconst extended = [...base, 3];",
      "explanation": "This small example gives you a safe place to inspect values while practising this objective: Explain spread and rest from their position.",
      "tryThis": "Replace the sample with a real spread and rest case from the explanation. Predict every logged value before running it.",
      "sourceIds": [
        "mdn-spread"
      ]
    },
    {
      "id": "example-2",
      "title": "Apply: Array spread",
      "kind": "fragment",
      "language": "js",
      "depth": "deeper",
      "code": "const user = { name: \"Ari\", active: false };\nconst updated = { ...user, active: true };",
      "explanation": "This small example gives you a safe place to inspect values while practising this objective: Copy and combine arrays with spread.",
      "tryThis": "Replace the sample with a real spread and rest case from the explanation. Predict every logged value before running it.",
      "sourceIds": [
        "mdn-spread"
      ]
    },
    {
      "id": "example-3",
      "title": "Apply: Object spread",
      "kind": "fragment",
      "language": "js",
      "depth": "deeper",
      "code": "function total(...numbers) {\n  return numbers.reduce((sum, number) => sum + number, 0);\n}",
      "explanation": "This small example gives you a safe place to inspect values while practising this objective: Copy and override object properties.",
      "tryThis": "Replace the sample with a real spread and rest case from the explanation. Predict every logged value before running it.",
      "sourceIds": [
        "mdn-spread"
      ]
    }
  ],
  "practice": [
    {
      "id": "p01",
      "type": "predict",
      "difficulty": "beginner",
      "prompt": "Write one short code example for “The same dots have two jobs”. Predict each result before running it.",
      "hints": [
        "Return to the “The same dots have two jobs” explanation and identify the exact rule before writing code."
      ],
      "acceptanceCriteria": [
        "The attempt uses valid JavaScript.",
        "The written prediction or explanation matches the observed behavior.",
        "The answer names the rule that makes the result happen."
      ],
      "objectiveIds": [
        "difference"
      ],
      "sourceIds": [
        "mdn-spread"
      ],
      "solution": {
        "explanation": "A valid answer must demonstrate this rule: Explain spread and rest from their position. The exact names and sample values may differ. Compare behavior and reasoning, not surface syntax.",
        "code": "// One possible checking structure\nconst prediction = \"Write the expected result first\";\nconsole.log(prediction);",
        "language": "js",
        "kind": "fragment"
      },
      "solutionPresentation": "modal",
      "attemptBeforeReveal": true
    },
    {
      "id": "p02",
      "type": "build",
      "difficulty": "beginner",
      "prompt": "Build a small function or data example that proves this objective: Copy and combine arrays with spread.",
      "hints": [
        "Return to the “Array spread” explanation and identify the exact rule before writing code."
      ],
      "acceptanceCriteria": [
        "The attempt uses valid JavaScript.",
        "The written prediction or explanation matches the observed behavior.",
        "The answer names the rule that makes the result happen."
      ],
      "objectiveIds": [
        "array"
      ],
      "sourceIds": [
        "mdn-spread"
      ],
      "solution": {
        "explanation": "A valid answer must demonstrate this rule: Copy and combine arrays with spread. The exact names and sample values may differ. Compare behavior and reasoning, not surface syntax.",
        "code": "// One possible checking structure\nconst prediction = \"Write the expected result first\";\nconsole.log(prediction);",
        "language": "js",
        "kind": "fragment"
      },
      "solutionPresentation": "modal",
      "attemptBeforeReveal": true
    },
    {
      "id": "p03",
      "type": "debug",
      "difficulty": "intermediate",
      "prompt": "Create a deliberate spread and rest mistake, record the symptom, and repair the cause.",
      "hints": [
        "Return to the “Object spread” explanation and identify the exact rule before writing code."
      ],
      "acceptanceCriteria": [
        "The attempt uses valid JavaScript.",
        "The written prediction or explanation matches the observed behavior.",
        "The answer names the rule that makes the result happen."
      ],
      "objectiveIds": [
        "object"
      ],
      "sourceIds": [
        "mdn-spread"
      ],
      "solution": {
        "explanation": "A valid answer must demonstrate this rule: Copy and override object properties. The exact names and sample values may differ. Compare behavior and reasoning, not surface syntax.",
        "code": "// One possible checking structure\nconst prediction = \"Write the expected result first\";\nconsole.log(prediction);",
        "language": "js",
        "kind": "fragment"
      },
      "solutionPresentation": "modal",
      "attemptBeforeReveal": true
    },
    {
      "id": "p04",
      "type": "transfer",
      "difficulty": "intermediate",
      "prompt": "Use rest parameters in a different example from this lesson and explain why your choice is correct.",
      "hints": [
        "Return to the “Rest parameters” explanation and identify the exact rule before writing code."
      ],